{
  "$schema": "http://json-schema.org/draft-04/schema#",
  "additionalProperties": false,
  "definitions": {
    "company": {
      "$ref": "file:schemas/company.json"
    }
  },
  "id": "enrich_company_response.schema.json",
  "properties": {
    "company": {
      "$ref": "#/definitions/company"
    },
    "status": {
      "default": "found",
      "id": "/properties/status",
      "type": "string"
    },
    "match_request_id": {
      "default": "e63fa057-8b3a-462e-b257-257d5251ad2b",
      "id": "/properties/match_request_id",
      "type": "string"
    },
    "total_count": {
      "id": "/properties/total_count",
      "type": "number"
    }
  },
  "required": [
    "company", "status", "total_count", "match_request_id"
  ],
  "type": "object"
}
