{
  "match_request_id": "e63fa057-8b3a-462e-b257-257d5251ad2b",
  "total_count": 1,
  "status": "found",
  "company": {
    "name": "Honeypot GmbH",
    "id": "234567876543234567",
    "refId": "optional ref id",
    "location": [ "Berlin, Germany" ],
    "url": "https://www.honeypot.io",
    "profileUrls": [
      "https://github.com/honeypotio",
      "https://linkedin.com/company/honeypot"
    ],
    "positions": [
      {
        "id": "23a8b975-cb34-4804-b8b1-14c194de9fe4",
        "refId": "optional reference id",
        "name": "ruby developer",
        "requiredTechnologies": ["Ruby"],
        "technologies": ["Rails", "API"],
        "yearsOfXp": 3,
        "yearsRelevantXp": 3,
        "description": "4+ years experience with Ruby on Rails and API's"
      }
    ]
  }
}
